{
  "schema_version": "quickdraw.bdq-replay-storage.v1",
  "task": "R3N",
  "purpose": "Replace retained duplicate float32 observation stacks with lossless content-addressed frame storage while preserving the complete public replay, sampling, optimizer, and R3M behavior contracts under a fail-closed four-GiB accounting ceiling.",
  "base_fourth_update_contract": {
    "path": "Research/trainer/bdq-fourth-update-contract-v1.json",
    "sha256": "0a6f209d93ef6d522a53f24807d4ce48e6e820a344905e9762583bbe13a72dbb",
    "schema_version": "quickdraw.bdq-fourth-update.v1",
    "pushed_commit": "2ec3ec39d25d5d3bb5686574255898f3f5605d3f"
  },
  "runtime": {
    "python": "3.11.13",
    "mlagents_envs": "1.1.0",
    "numpy": "1.23.5",
    "torch": "2.12.0+cpu",
    "device": "cpu"
  },
  "package": {
    "distribution": "quickdraw-bdq-trainer",
    "version": "0.3.0",
    "metadata_path": "Research/trainer/pyproject.toml",
    "trainer_entry_points": []
  },
  "public_replay_interface": {
    "class": "quickdraw_bdq.replay.ReplayBuffer",
    "capacity": 100000,
    "batch_size": 64,
    "observation_shape": [84, 84, 4],
    "observation_layout": "HWC",
    "observation_dtype": "float32",
    "transition_fields": [
      "observation",
      "action",
      "reward",
      "next_observation",
      "action_masks",
      "next_action_masks",
      "terminated",
      "truncated"
    ],
    "sampling": "uniform_without_replacement",
    "rng": "numpy.random.Generator.PCG64",
    "ring_indices": "physical_slots_zero_through_size_minus_one",
    "overwrite": "replace_next_physical_slot_at_capacity",
    "batch_classes": [
      "quickdraw_bdq.replay.ReplayBatch",
      "quickdraw_bdq.replay.TorchReplayBatch"
    ]
  },
  "legacy_storage": {
    "representation": "two_owned_float32_observation_stacks_per_transition",
    "bytes_per_observation": 112896,
    "bytes_per_transition_observations": 225792,
    "capacity_observation_payload_bytes": 22579200000
  },
  "lossless_storage": {
    "representation": "content_addressed_raw_float32_frames_plus_columnar_transition_metadata",
    "frame_shape": [84, 84],
    "frame_dtype": "float32",
    "frame_payload_bytes": 28224,
    "frame_key": "exact_c_contiguous_float32_bytes",
    "frame_reference_dtype": "uint64",
    "frame_references_per_transition": 8,
    "reference_counting": true,
    "orphan_reclamation_on_ring_overwrite": true,
    "reconstruction": "bit_exact_hwc_float32",
    "input_copy_and_immutability_preserved": true,
    "lossy_quantization": false,
    "lossy_compression": false,
    "arbitrary_stream_rule": "Accept valid transitions while the storage ceiling holds; reject an over-budget addition atomically without changing replay state."
  },
  "memory_budget": {
    "max_accounted_storage_bytes": 4294967296,
    "accounting": "preallocated_numpy_payload_plus_conservative_array_frame_and_container_overhead",
    "frame_accounting_overhead_bytes": 1024,
    "metadata_array_accounting_overhead_bytes": 256,
    "fixed_accounting_overhead_bytes": 65536,
    "metadata_array_count": 10,
    "metadata_payload_bytes_at_capacity": 9600000,
    "metadata_accounted_bytes_at_capacity": 9668096,
    "registered_basic_distinct_render_states_upper_bound": 81,
    "registered_basic_projection_accounted_bytes": 12037184,
    "conservative_sequential_unique_frame_count": 100004,
    "conservative_sequential_projection_accounted_bytes": 2934585088,
    "maximum_unique_frames_within_budget": 146515,
    "excluded_transient_allocations": [
      "sampled ReplayBatch and TorchReplayBatch arrays",
      "caller-owned ReplayTransition values",
      "Python module and interpreter baseline",
      "online and target networks",
      "optimizer state",
      "Unity process memory"
    ],
    "budget_failure": "MemoryError before any visible replay mutation"
  },
  "equivalence": {
    "comparison": "legacy retained-transition oracle versus compact replay",
    "required_exact_batch_fields": [
      "indices",
      "observations",
      "actions",
      "rewards",
      "next_observations",
      "action_masks",
      "next_action_masks",
      "terminated",
      "truncated"
    ],
    "float_comparison": "bitwise",
    "preserve_shapes_dtypes_and_order": true,
    "preserve_seeded_rng_consumption": true,
    "cover_ring_wraparound": true,
    "cover_terminal_and_truncation_discontinuities": true,
    "production_sample_index_sha256": [
      {
        "replay_size": 10000,
        "sha256": "ce3daae8cb092f11074c30299313c8e61052bb42f76e8b90bb46281af53c9a49"
      },
      {
        "replay_size": 10004,
        "sha256": "c1a8b2fd7fcd64dc8c1375e536d8d2e5cd9e88809349d79336cf63777f8284f4"
      },
      {
        "replay_size": 10008,
        "sha256": "c2e180bea9bd403ae2b0296fe55478aea10a44cbb6d1d1726e966c0df8dcbb4d"
      },
      {
        "replay_size": 10012,
        "sha256": "de8af0d1e05eecfcb37bb52015fbd61f7124ec6ce46f3c3eef35e72cea86750a"
      }
    ],
    "combined_production_sample_indices_sha256": "f2e64136bd4dda6500e3a12c34ba9f4c362d0c1afba9e0743d766a786dd1ff9b"
  },
  "r3m_regression": {
    "fresh_process_count": 1,
    "comparison": "one fresh post-R3N worker against the frozen pre-R3N accepted trace",
    "serialized_trace_sha256": "762fd1d090dc88529f3ad86cd0ad87080aff6494587c10223ae89118bb910a51",
    "canonical_trace_sha256": "cd2fa70672432e74c16c34c0525035953961ac3845cbe3362e061373cf48a940",
    "all_transitions_sha256": "9b3fc70c5e3cdbc40c9332460ef702304086aa6d07c8467a411c31bcba059bef",
    "tail_four_transitions_sha256": "6c5d8647a1868f4f3c770b98e5bd8077f6b12a24bafceb4f5f384751156104e1",
    "update_events_sha256": "7f8d558ae177c52170841b8b48136e4b35eccb9fb478e9c0ce42d3193deaceba",
    "unique_full_stack_count": 1549,
    "conservative_unique_frame_upper_bound": 6196,
    "conservative_frame_payload_upper_bound_bytes": 174875904,
    "conservative_accounted_storage_upper_bound_bytes": 190888704,
    "update_decisions": [10000, 10004, 10008, 10012],
    "update_losses": [
      0.01628389209508896,
      0.014819225296378136,
      0.008735351264476776,
      0.0085072573274374
    ],
    "update_mean_absolute_td_errors": [
      0.06243317946791649,
      0.06711231172084808,
      0.06769348680973053,
      0.06249994412064552
    ],
    "online_hashes_after_updates": [
      "7dd2365b5e219af10aeb4fabb5191df873762fcea6765cb50f83d41525279c8e",
      "6248f286191da322a52ad0c97f569d30ecd49a1c86e9810bda4cb96ccc6b9471",
      "4f78e397e87ad6cea1ada78d49dea808337c401f6478970d1a4439065743775b",
      "a8356df1531b99a42966578c6fd784cd384c8bcd3d3c3092124df13b2587268f"
    ],
    "target_hash": "b605debdd6073caa41a95d636bcf20b35d000dc959b06d5cbe585cac0bb433bb",
    "target_sync_count": 0,
    "optimizer_update_count": 4,
    "transition_count": 10012
  },
  "test_scope": "Contract/schema binding, conservative capacity accounting, exact legacy-oracle batch equivalence, repeated seeded sampling, ring overwrite and frame reclamation, immutable ownership, atomic budget rejection, optimizer equivalence, and one fresh canonical R3M regression.",
  "exclusions": [
    "optimizer update 5",
    "target synchronization",
    "extended Unity collection or training",
    "checkpoint, resume, or inference export",
    "ROCm training",
    "multi-environment collection",
    "Unity scene, observation, action, reward, or episode changes",
    "policy-effectiveness claims"
  ]
}
